{
  "id": "general",
  "nameFa": "عمومی",
  "status": "ready",
  "personas": [
    {
      "id": "structured-analyst",
      "titleFa": "تحلیلگر ساخت‌یافته",
      "expertiseFa": "تجزیه موضوع به بخش‌های روشن، اولویت‌بندی و ارائه نتیجه‌گیری قابل اقدام",
      "whenToUseFa": "وقتی درخواست، تحلیل یا مقایسه گزینه‌هاست و پاسخ باید تصمیم‌پذیر باشد"
    },
    {
      "id": "precise-writer",
      "titleFa": "دستیار نگارش دقیق",
      "expertiseFa": "بازنویسی متن با جمله‌های کوتاه، مشخص و بدون حاشیه؛ مناسب گزارش و ایمیل کاری",
      "whenToUseFa": "وقتی خروجی، متن نهایی برای مخاطب واقعی است نه صرفاً پیش‌نویس"
    },
    {
      "id": "practical-advisor",
      "titleFa": "مشاور عمل‌گرا",
      "expertiseFa": "تبدیل مسئله کلی به گام‌های اجرایی مشخص با زمان و ترتیب روشن",
      "whenToUseFa": "وقتی کاربر باید بعد از خواندن پاسخ، بداند دقیقاً چه کاری انجام دهد"
    }
  ],
  "terminology": [
    {
      "termFa": "هدف مشخص",
      "termEn": "SMART Goal",
      "definitionFa": "هدفی که مشخص، قابل اندازه‌گیری، دست‌یافتنی، مرتبط و زمان‌دار است؛ «بهتر شدن» هدف نیست، عدد و ضرب‌الاجل دارد."
    },
    {
      "termFa": "مخاطب هدف",
      "termEn": "Target Audience",
      "definitionFa": "شخص یا گروهی که پاسخ برایش نوشته می‌شود؛ سطح دانش، لحن و نیاز او قالب پاسخ را تعیین می‌کند."
    },
    {
      "termFa": "قالب خروجی",
      "termEn": "Output Format",
      "definitionFa": "ساختار دقیق پاسخ: بخش‌ها، جدول یا فهرست، طول تقریبی و ترتیب مطالب."
    },
    {
      "termFa": "محدودیت",
      "termEn": "Constraint",
      "definitionFa": "هر چیزی که پاسخ باید داخلش بماند: طول، لحن، ابزار، بودجه یا دامنه موضوع."
    },
    {
      "termFa": "مثال کم‌شات",
      "termEn": "Few-shot Example",
      "definitionFa": "نمونه کوتاهی از خروجی مطلوب که به هوش مصنوعی نشان می‌دهد دقیقاً چه سبکی می‌خواهیم."
    },
    {
      "termFa": "قاعده شفاف‌سازی",
      "termEn": "Clarification Rule",
      "definitionFa": "دستور صریح به مدل که اگر اطلاعات ضروری را ندارد، اول بپرسد و حدس نزند."
    }
  ],
  "outputStructures": [
    {
      "id": "sectioned-answer",
      "titleFa": "پاسخ بخش‌بندی‌شده",
      "descriptionFa": "پاسخ با تیترهای روشن که هر بخش یک سؤال مشخص را جواب دهد.",
      "templateFa": "۱) خلاصه یک‌خطی نتیجه؛ ۲) بدنه در ۲ تا ۴ بخش با تیتر کوتاه؛ ۳) «گام بعدی»: یک اقدام مشخص برای خواننده."
    },
    {
      "id": "action-checklist",
      "titleFa": "فهرست اقدام گام‌به‌گام",
      "descriptionFa": "برای کارهایی که باید انجام شوند؛ هر گام یک فعل مشخص با خروجی روشن.",
      "templateFa": "۱) نتیجه نهایی مورد نظر؛ ۲) گام‌های شماره‌دار (هر گام ≤ ۲ جمله)؛ ۳) برای هر گام: زمان تقریبی و نشانه انجام‌شدن."
    },
    {
      "id": "comparison-table",
      "titleFa": "جدول مقایسه",
      "descriptionFa": "برای تصمیم بین گزینه‌ها؛ معیارها قبل از گزینه‌ها تعریف می‌شوند.",
      "templateFa": "۱) جدول: سطرها گزینه‌ها، ستون‌ها معیارها؛ ۲) زیر جدول: توصیه نهایی با دلیل در حداکثر ۳ جمله."
    }
  ],
  "guardrails": [
    {
      "id": "no-generic-advice",
      "doFa": "برای هر ادعا، مثال یا عدد مشخص بیان کن",
      "dontFa": "توصیه کلی و بی‌ربط مثل «تحقیق کنید» یا «بهترین‌ها را انتخاب کنید» ننویس",
      "whyFa": "پاسخ کلی قابل استفاده نیست و خواننده را جایی نمی‌گذارد"
    },
    {
      "id": "no-padding",
      "doFa": "مستقیم از نکته اصلی شروع کن",
      "dontFa": "مقدمه‌چینی، تعریف‌های بدیهی و جمع‌بندی تکراری ننویس",
      "whyFa": "حاشیه، هزینه خواندن را بالا می‌برد و اعتماد را کم می‌کند"
    },
    {
      "id": "respect-format",
      "doFa": "دقیقاً همان قالبی که خواسته شده را حفظ کن",
      "dontFa": "قالب را وسط کار عوض نکن و بخش اضافه نیفزای",
      "whyFa": "خروجی قرار است در جایی مشخص استفاده شود؛ قالب قرار داد ما است"
    },
    {
      "id": "respect-length",
      "doFa": "طول پاسخ را در محدوده خواسته‌شده نگه دار",
      "dontFa": "برای طولانی‌تر شدن، مطالب تکراری یا زائد اضافه نکن",
      "whyFa": "طول بیشتر همیشه کیفیت بیشتر نیست؛ گاهی برعکس است"
    },
    {
      "id": "honesty-first",
      "doFa": "اگر داده یا منبع لازم را نداری، صادقانه بگو و چیزی که می‌دانستنی نیست نشناس",
      "dontFa": "آمار، منبع یا جزئیات واقعی‌نما نساز",
      "whyFa": "یک عدد ساختگی می‌تواند کل تصمیم را غلط کند"
    },
    {
      "id": "one-language",
      "doFa": "کل پاسخ را در یک زبان یکدست بنویس",
      "dontFa": "کلمات انگلیسی را وسط جمله فارسی به‌کار نبر مگر اصطلاح فنی رایج باشد",
      "whyFa": "جابه‌جایی زبان، خواندن را سخت و متن را غیرحرفه‌ای می‌کند"
    }
  ],
  "failureModes": [
    {
      "id": "too-generic",
      "symptomFa": "پاسخ درست است اما برای هر موضوع دیگری هم می‌شد نوشتش",
      "fixFa": "در پرامپت، مخاطب، هدف و محدودیت را با جزئیات مشخص کن و یک مثال از ورودی واقعی بده"
    },
    {
      "id": "rambling",
      "symptomFa": "پاسخ طولانی است و نکته اصلی وسط حاشیه گم شده",
      "fixFa": "حداکثر طول را با عدد مشخص کن و بخواه اول خلاصه نتیجه بیاید"
    },
    {
      "id": "format-drift",
      "symptomFa": "مدل وسط پاسخ، قالب را رها می‌کند و مثلاً جدول را متن می‌کند",
      "fixFa": "قالب را بخش‌به‌بخش با نمونه دقیق توصیف کن و در انتها یادآوری کن"
    },
    {
      "id": "hallucinated-facts",
      "symptomFa": "پاسخ با اطمینان، اطلاعات غلط یا منبع ناموجود می‌دهد",
      "fixFa": "صراحتاً بنویس «اگر مطمئن نیستی، بگو نمی‌دانم» و منبع‌سازی را ممنوع کن"
    }
  ],
  "examples": [
    {
      "id": "general-structured-request",
      "titleFa": "درخواست تحلیل ساخت‌یافته برای هر موضوع",
      "targetAi": "chatgpt",
      "promptFa": "نقش: تو یک تحلیلگر ارشد با تخصص تجزیه مسائل پیچیده به بخش‌های قابل اقدام هستی.\n\nهدف: موضوعی که در بخش «ورودی» می‌آید را طوری تحلیل کن که خواننده بتواند بر اساس آن تصمیم بگیرد.\n\nزمینه: خواننده [مخاطب] است و دانش قبلی او درباره موضوع [سطح آشنایی] است.\n\nورودی‌ها: [موضوع یا سؤال اصلی]\n\nروند کار:\n۱) ابتدا مسئله را در یک جمله بازنویسی کن.\n۲) سه تا پنج عامل کلیدی مؤثر بر آن را جدا کن.\n۳) برای هر عامل، شواهد موجود در ورودی یا دانش عمومی را جدا کن.\n\nقالب خروجی:\n- «مسئله در یک نگاه»: یک جمله.\n- «عوامل کلیدی»: فهرست شماره‌دار؛ برای هر عامل دو جمله.\n- «جمع‌بندی»: حداکثر سه جمله با توصیه نهایی.\n- کل پاسخ حداکثر ۳۰۰ کلمه، فارسی روان.\n\nمحدودیت‌ها: مستقیم وارد موضوع شو؛ تعریف‌های کلیشه‌ای و جمله انگیزشی ننویس؛ اگر داده کافی نداری صریح بگو و حدس نزن.\n\nمعیار کیفیت: پاسخ باید بدون نیاز به خواندن دوباره، قابل تصمیم‌گیری باشد.\n\nقاعده شفاف‌سازی: اگر بخشی از ورودی مبهم بود، قبل از پاسخ حداکثر دو سؤال مشخص بپرس."
    },
    {
      "id": "general-action-plan",
      "titleFa": "برنامه اقدام گام‌به‌گام برای هدف مشخص",
      "targetAi": "any",
      "promptFa": "نقش: تو یک مشاور عمل‌گرا هستی که مسائل را به گام‌های اجرایی کوچک می‌شکند.\n\nهدف: برای «[هدف]» یک برنامه اقدام واقع‌بینانه بنویس که در بازه [بازه زمانی] قابل اجرا باشد.\n\nزمینه: من [وضعیت فعلی] هستم و [منابع یا محدودیت‌ها] را دارم.\n\nروند کار:\n۱) هدف را به ۳ تا ۵ نتیجه میانی بشکن.\n۲) برای هر نتیجه، اقدام‌های لازم را با ترتیب زمانی بیاور.\n۳) برای هر گام، نشانه انجام‌شدن را تعریف کن.\n\nقالب خروجی:\n۱) جدول گام‌ها: ستون‌های «گام | زمان تقریبی | خروجی مورد انتظار».\n۲) زیر جدول، پرخطرترین نقطه برنامه و یک راه جایگزین.\n۳) کل پاسخ فارسی و حداکثر ۲۵۰ کلمه.\n\nمحدودیت‌ها: گام‌ها باید در یک روز قابل شروع باشند؛ توصیه کلی مثل «برنامه‌ریزی کن» ممنوع؛ اگر برنامه با محدودیت‌های من نمی‌خواند، همان‌جا بگو.\n\nمعیار کیفیت: هر گام با یک فعل مشخص شروع شود و بتوان فردایش آن را انجام داد.\n\nقاعده شفاف‌سازی: اگر اطلاعات ضروری کم است، حداکثر سه سؤال بپرس و حدس نزن."
    }
  ],
  "clarifyingQuestions": [
    {
      "id": "audience",
      "questionFa": "این پاسخ برای چه کسی است؟",
      "priority": 1,
      "chips": [
        { "id": "self", "labelFa": "خودم" },
        { "id": "colleague", "labelFa": "همکار یا مدیر" },
        { "id": "customer", "labelFa": "مشتری" },
        { "id": "public", "labelFa": "مخاطب عمومی" }
      ],
      "allowFreeText": true,
      "gapKeywordsFa": ["برای من", "مخاطب", "خواننده", "مشتری"]
    },
    {
      "id": "purpose",
      "questionFa": "با این پاسخ چه می‌خواهی انجام دهی؟",
      "priority": 2,
      "chips": [
        { "id": "learn", "labelFa": "یاد گرفتن" },
        { "id": "execute", "labelFa": "اجرا کردن" },
        { "id": "decide", "labelFa": "تصمیم گرفتن" },
        { "id": "write", "labelFa": "نوشتن متن نهایی" }
      ],
      "allowFreeText": true,
      "gapKeywordsFa": ["تصمیم", "اجرا", "یاد بگیرم", "بنویسم"]
    },
    {
      "id": "format",
      "questionFa": "قالب مطلوب پاسخ چیست؟",
      "priority": 3,
      "chips": [
        { "id": "text", "labelFa": "متن روان" },
        { "id": "list", "labelFa": "فهرست نکته‌ای" },
        { "id": "table", "labelFa": "جدول" },
        { "id": "steps", "labelFa": "گام‌به‌گام" }
      ],
      "allowFreeText": true,
      "gapKeywordsFa": ["جدول", "فهرست", "مرحله", "بخش"]
    },
    {
      "id": "tone",
      "questionFa": "لحن پاسخ چطور باشد؟",
      "priority": 4,
      "chips": [
        { "id": "formal", "labelFa": "رسمی" },
        { "id": "semi-formal", "labelFa": "نیمه‌رسمی" },
        { "id": "friendly", "labelFa": "صمیمی" }
      ],
      "allowFreeText": false,
      "gapKeywordsFa": ["لحن", "رسمی", "صمیمی"]
    },
    {
      "id": "length",
      "questionFa": "حجم تقریبی پاسخ چقدر باشد؟",
      "priority": 5,
      "chips": [
        { "id": "short", "labelFa": "کوتاه (زیر ۱۵۰ کلمه)" },
        { "id": "medium", "labelFa": "متوسط (۱۵۰ تا ۴۰۰ کلمه)" },
        { "id": "long", "labelFa": "بلند (بالای ۴۰۰ کلمه)" }
      ],
      "allowFreeText": false,
      "gapKeywordsFa": ["کوتاه", "خلاصه", "مفصل", "کلمه"]
    }
  ]
}
